{
  "$schema": "./adimlar.schema.json",
  "version": "1.0.0",
  "title": "xurrent-mcp — atölye: bu proje nasıl üretildi",
  "subtitle": "Sihirbaz uygulamanın NE YAPTIĞINI öğretir. Atölye NASIL ÜRETİLDİĞİNİ.",
  "tahminiDakika": 75,
  "fazlar": [
    {
      "id": "kesif",
      "baslik": "Keşif — kod yazmadan önce",
      "ozet": "Beş paralel araştırma kolu, sıfır satır kod. Bulunan tek kısıt tüm yazma mimarisini belirledi."
    },
    {
      "id": "sozlesme",
      "baslik": "Sözleşme ve veri",
      "ozet": "Önce dil-bağımsız tool sözleşmesi, sonra tuzak öğretmek için kurgulanmış mock veri."
    },
    {
      "id": "uygulama",
      "baslik": "Üç implementasyon",
      "ozet": "Aynı sözleşme, üç dil, paralel üretim. İş mantığı protokolden ayrı tutuldu."
    },
    {
      "id": "degisim",
      "baslik": "Spec iş ortasında değişti",
      "ozet": "MCP 2026-07-28 tam olarak bizim onay akışımızı kaldırdı. Mimari kararı varsayarak değil ölçerek verdik."
    },
    {
      "id": "dogrulama",
      "baslik": "Kusur avı ve live yolu",
      "ozet": "Ajan raporlarına güvenilmedi; bağımsız ölçüldü. Üç gerçek kusur çıktı, bir de hiç çalıştırılmamış kod yolu."
    },
    {
      "id": "yayin",
      "baslik": "Yayın",
      "ozet": "Mantıksal commit'ler, sır taraması, ve neyin doğrulanmadığını yazma disiplini."
    },
    {
      "id": "genisleme",
      "baslik": "Genişleme — sözleşme büyürken tez değişmedi",
      "ozet": "Güvenilirlik katmanı, iki yeni tool, ikinci transport, dış yüzeyler. Her biri önce sözleşmeye yazıldı, sonra üç dile birden uygulandı."
    }
  ],
  "adimlar": [
    {
      "id": "01-ister-cercevesi",
      "faz": "kesif",
      "baslik": "Dört ister, bir soru: bu bir script mi, bir sunucu mu?",
      "anlat": [
        "Elimizde dört cümlelik bir ister listesi vardı: bir kişinin açık taleplerini ve görevlerini id + açıklama ile listele, her biri için kullanıcı süre belirtsin, girişleri ilgili kişi ve görev için Xurrent'a kaydet, ve kişinin o günkü takvimini okuyup her toplantıyı zaman girişine çevir.",
        "Dördüncü ister ilk üçünden farklıdır ve bu fark ilk kararı belirledi. 'Her bir toplantıyı zaman girişi olarak ekle' cümlesi otomatik bir işmiş gibi durur — ama takvimde doğum günü de vardır, reddedilmiş bir toplantı da, birbiriyle çakışan iki randevu da. Ortada tek atışlık bir istek değil, bir müzakere vardır.",
        "İkinci ister de aynı yere çıkıyordu: 'kullanıcı süre belirtsin' demek, hangi ticket, süre yuvarlanacak mı, dünkü tarih kabul edilir mi sorularının konuşulması demektir.",
        "Müzakere gerektiren bir iş, API çağrısından çok diyalog yönetimidir. Diyaloğu kendimiz yazarsak her yeni istemci için baştan yazarız."
      ],
      "prompt": "Bir ITSM ürünü (Xurrent) için dört isteri karşılayan bir uygulama tasarlayacağız:\n  1) bir kişinin üzerindeki açık talep/görevleri id + açıklama ile listele\n  2) her biri için kullanıcı süre belirtsin (başlangıç saati; tarih bugün veya dün olabilir)\n  3) girişleri ilgili kişi ve görev için kaydet\n  4) kişinin o günkü takvimini oku, her toplantıyı zaman girişi olarak ekle\n\nKOD YAZMA. Önce şunu cevapla: bu iş bir CLI script'i mi, bir MCP sunucusu mu,\nyoksa LLM'e doğrudan GraphQL yazdırmak mı?\n\nÜç seçeneğin HER BİRİ için İSTER #2'nin nasıl karşılanacağını somut olarak anlat.\nCevabını şu soru üzerinden kur: bu seçenekte kullanıcıyla kaç tur konuşulur ve o\nturları kim yürütür?",
      "karar": {
        "soru": "Bu iş hangi biçimde paketlenecek?",
        "secenekler": [
          {
            "etiket": "Düz CLI script'i veya kütüphane",
            "artisi": "En az katman, en az bağımlılık; hemen çalışan bir şey",
            "eksisi": "Diyalog yönetimi elle yazılır ve her yeni arayüz için baştan yazılır"
          },
          {
            "etiket": "LLM'e Xurrent GraphQL şemasını verip sorguyu ona yazdır",
            "artisi": "Tool tasarlamaya gerek yok; şema zaten mevcut",
            "eksisi": "Serbest sorgu üretimi serbest mutation üretimi demektir; şema context'e sığmaz; keşfedilen tuzaklar her konuşmada yeniden riske girer"
          },
          {
            "etiket": "MCP sunucusu + ince istemciler",
            "artisi": "Diyaloğu host LLM yürütür; aynı sunucu Claude Code'a, terminal chatbot'a, web arayüzüne ve sihirbaza takılır",
            "eksisi": "Protokol katmanı, onay akışı ve sözleşme bakımı ek iştir"
          }
        ],
        "secilen": "MCP sunucusu + ince istemciler",
        "neden": "İster #2 bir müzakeredir. Müzakereyi bir kez tool yüzeyi olarak tanımlayıp diyaloğu LLM'e bırakmak, aynı işi birden çok istemcide birden çalıştırır. Repoda bunun kanıtı duruyor: aynı sunucuya dört farklı istemci bağlanıyor ve hiçbiri iş mantığını tekrarlamıyor."
      },
      "uretilenDosyalar": [
        "docs/00-genel-bakis.md",
        "README.md"
      ],
      "dogrulama": null,
      "ogrenim": [
        "Bir isteri okurken 'kaç tur konuşulacak' sorusunu sor. Tek turluk işler script'tir; çok turlu işler bir yetenek yüzeyi ister.",
        "Paketleme kararı geri dönmesi en pahalı karardır; bu yüzden kod yazmadan önce verilir.",
        "Aynı iş mantığına birden çok istemci bağlanacaksa mantığı istemciden ayır. Bu kural MCP'ye özel değil; MCP sadece ayrımı zorunlu kılıyor."
      ],
      "tuzak": null,
      "docs": "docs/00-genel-bakis.md"
    },
    {
      "id": "02-once-kesif-sonra-kod",
      "faz": "kesif",
      "baslik": "Beş paralel araştırma kolu, sıfır satır kod",
      "anlat": [
        "İlk aşamada hiç kod yazılmadı. Bunun yerine beş araştırma kolu paralel çalıştırıldı: Xurrent GraphQL şeması ve kimlik doğrulama, zaman girişi veri modeli, takvim sağlayıcıları (Microsoft Graph ve Google), MCP protokolü ile üç dilin SDK'ları, ve ekosistem farkları. Toplam yaklaşık 887 bin token harcandı.",
        "Paralel çalışmanın asıl faydası hız değil, çapraz doğrulamadır. Bir kol yanılırsa diğerinin çıktısı onunla çelişir; çelişki de bir bulgudur.",
        "Çıktı kod değil, karar veriydi: docs/01, docs/02 ve docs/04 bu kolların yazıya dökülmüş hâlidir.",
        "Keşfin en değerli ürünü ise bir liste oldu — neyi BİLMİYORUZ. docs/08 içindeki DOĞRULANMALI maddeleri (D1'den D13'e) tam olarak budur: resmî dokümantasyondan çıkarılmış ama canlı bir hesapta gözlenmemiş her iddia oraya yazıldı."
      ],
      "prompt": "Xurrent'ın GraphQL API'sini araştır. HENÜZ KOD YAZMA.\n\nŞu beş soruyu ayrı ayrı cevapla ve her cevabın yanına kaynağını yaz:\n  1. Kimlik doğrulama nasıl yapılır? Hangi header'lar zorunlu? Bölge URL'leri neler?\n  2. Bir kişinin açık Request ve Task'larını çekmek için filtre alanları tam olarak ne?\n     Request ve Task filtreleri AYNI mı? Terminal (kapalı) durumların TAM listesi ne?\n  3. TimeEntry nasıl oluşturulur? TimeEntryCreateInput'un TÜM alanlarını listele.\n  4. Timesheet ayarları nereden okunur? timeIncrement nedir, varsayılanı kaç?\n  5. Rate limit nedir, hangi header'larla raporlanır?\n\nHer cevap için ayrıca şunu belirt: bu bilgi resmî dokümantasyonda AÇIKÇA yazıyor mu,\nyoksa çıkarım mı? Çıkarım olanları ayrı bir 'DOĞRULANMALI' listesinde topla ve her\nmadde için 'nasıl doğrularım' ile 'yanlışsa ne olur' sorularını cevapla.",
      "karar": {
        "soru": "Keşif ne kadar sürsün?",
        "secenekler": [
          {
            "etiket": "İskeleti hemen kur, API'yi yol boyu öğren",
            "artisi": "İlk saatte çalışan bir şey; ilerleme hissi",
            "eksisi": "Yanlış varsayım üzerine kurulan mimari, bulgu geldiğinde baştan yazılır"
          },
          {
            "etiket": "Resmî SDK örneğini kopyala, üstüne inşa et",
            "artisi": "En hızlı başlangıç; protokol tarafı hazır gelir",
            "eksisi": "Örnek bizim isterimizi tanımaz; alan kısıtlarını hiç görmezsin"
          },
          {
            "etiket": "Önce kapsamlı keşif, sonra tek seferde doğru mimari",
            "artisi": "Kısıtlar mimariyi belirler, tersi değil",
            "eksisi": "İlk aşamada gösterilecek çalışan bir şey yok"
          }
        ],
        "secilen": "Önce kapsamlı keşif, sonra tek seferde doğru mimari",
        "neden": "Bir sonraki adımdaki tek bulgu — timeEntryCreate bir ticket'a bağlanamaz — tüm yazma mimarisini belirledi. O bulguyu kaçırıp kod yazmaya başlasaydık, iki gün sonra baştan yazardık. AI destekli geliştirmede keşfin maliyeti token, yanlış mimarinin maliyeti zamandır; oran bozuk olduğu için keşfe fazladan harcamak neredeyse her zaman kârdır."
      },
      "uretilenDosyalar": [
        "docs/01-xurrent-api.md",
        "docs/02-zaman-girisi-modeli.md",
        "docs/04-takvim.md",
        "docs/08-riskler-ve-sss.md"
      ],
      "dogrulama": {
        "komut": "node clients/wizard/wizard.mjs --server ts --step 04 --auto --json",
        "beklenen": "0 başarısız",
        "cikisKodu": 0
      },
      "ogrenim": [
        "Araştırma çıktısını 'bildiklerimiz' ve 'çıkarımlarımız' diye ikiye ayır. İkinci liste, ilk canlı bağlantıda sırayla yürütülecek iş listendir.",
        "Bir kısıtı erken bulmak, onu geç bulmaktan katbekat ucuzdur. Keşif bütçesini kod bütçesinden ayrı düşün.",
        "Paralel araştırma kollarının değeri hız değil, birbirini denetlemeleridir."
      ],
      "tuzak": "Araştırma sırasında Xurrent'ın 'eu' diye bir bölge endpoint'i olduğu varsayıldı. Wildcard DNS yüzünden adres çözülüyor ama TLS patlıyor ve hata 'ağ sorunu' gibi görünüyor. Böyle bir bölge yok; Global zaten Avrupa. Doğrulanmamış bir varsayım yalnızca yanlış kod üretmez, hata mesajını da yanlış yere baktırır.",
      "docs": "docs/01-xurrent-api.md"
    },
    {
      "id": "03-kisit-mimariyi-belirledi",
      "faz": "kesif",
      "baslik": "★ İki mutation, aynı iş, farklı yetenekler — ve ister ikisiyle de karşılanmıyor",
      "anlat": [
        "Bu projenin tek en önemli bulgusu şudur: TimeEntryCreateInput içinde requestId, taskId veya assignmentId alanı YOKTUR. Yani timeEntryCreate ile oluşturulan bir zaman girişi bir Request veya Task'a bağlanamaz.",